{
  "schema_version": 2,
  "initial_phase": "NEW",
  "terminal_phases": ["HANDOFF_READY", "CANCELLED"],
  "phases": [
    "NEW", "ORIENTING", "CONTRACTED", "PLANNED", "PLAN_REVIEW", "HARNESSING",
    "IMPLEMENTING", "VERIFYING", "REVIEWING", "REMEDIATING", "FINALIZING",
    "HANDOFF_READY", "CANCELLED"
  ],
  "statuses": [
    "ACTIVE", "DEGRADED", "PAUSED", "BLOCKED", "NON_CONVERGENT", "COMPLETE", "CANCELLED"
  ],
  "transitions": {
    "NEW": ["ORIENTING", "CANCELLED"],
    "ORIENTING": ["CONTRACTED", "CANCELLED"],
    "CONTRACTED": ["PLANNED", "CANCELLED"],
    "PLANNED": ["PLAN_REVIEW", "HARNESSING", "CANCELLED"],
    "PLAN_REVIEW": ["PLANNED", "HARNESSING", "CANCELLED"],
    "HARNESSING": ["IMPLEMENTING", "CANCELLED"],
    "IMPLEMENTING": ["VERIFYING", "CANCELLED"],
    "VERIFYING": ["REMEDIATING", "REVIEWING", "CANCELLED"],
    "REVIEWING": ["REMEDIATING", "FINALIZING", "CANCELLED"],
    "REMEDIATING": ["VERIFYING", "PLANNED", "HARNESSING", "CANCELLED"],
    "FINALIZING": ["HANDOFF_READY", "CANCELLED"],
    "HANDOFF_READY": [],
    "CANCELLED": []
  },
  "risk_gates": {
    "LOW": { "plan_review": false, "code_review": true, "safety_environment_review": false },
    "MEDIUM": { "plan_review": true, "code_review": true, "safety_environment_review": false },
    "HIGH": { "plan_review": true, "code_review": true, "safety_environment_review": true }
  }
}
